id,name,ingredients,preparation,image,category_id,proportion,time_prep,time_cook,description
1291,Pâté chaud de Chambéry,"[""-  750 g de veau (tendron)"", ""-  100 g de lard gras haché"", ""-  1 gros oignon"", ""-  1 petit bouquet de persil plat"", ""-  50 g de cédrat confit (rayon fruits confits)"", ""-  1/2 verre de vinaigre de vin"", ""-  Sel, poivrePour la pâte :"", ""-  500 g de farine"", ""-  150 g de beurre mou"", ""-  100 g de saindoux"", ""-  4 jaunes d'oeufs + 1 jaune pour dorer"", ""-  1 cuil. à café bombée de selSauce rousse :"", ""-  50 g de beurre"", ""-  40 g de farine"", ""-  1 tablette de bouillon de boeuf"", ""-  4 cuil. à soupe de madère"", ""-  1 cuil. à soupe de vinaigre""]","[""La veille, préparez la pâte : versez la farine dans une jatte. Ajoutez le beurre, le saindoux et le sel. Mélangez du bout des doigts jusqu'à l'obtention d'une semoule grossière. Liez avec les jaunes d'oeufs et, si nécessaire, ajoutez 2 cuillerées à soupe d'eau. Formez une boule, enveloppez-la dans du film alimentaire et conservez-la au frais jusqu'au lendemain."", ""D'autre part, coupez la viande de veau en tout petits carrés et faites-la mariner une nuit dans le vinaigre et un demi-verre d'eau."", ""Le lendemain : sortez la pâte du réfrigérateur 20 min avant l'emploi et divisez-la en deux parts (2/3, 1/3). Étalez la plus grosse part sur la table farinée, puis garnissez-en une tourtière en porcelaine beurrée. Saupoudrez le fond de pâte avec les 2 cuillerées de farine."", ""Hachez l'oignon avec le persil. Mélangez avec le lard gras, le cédrat confit coupé en petits dés, du sel et du poivre. Recouvrez-en la pâte. Ajoutez le veau bien égoutté. Salez, poivrez. Préchauffez le four à 240 C (th. 8)."", ""Étalez le tiers de pâte restant en un couvercle. Posez-le sur la tourte, soudez les bords à la fourchette, percez une cheminée au centre et glissez-y un bristol roulé pour la maintenir ouverte. Dorez tout le dessus de la tourte de jaune d'oeuf délayé avec 1 cuillerée à café d'eau."", ""Enfournez à mi-hauteur et faites cuire 10 min à 240 C (th. 8), puis réduisez la température à 200 C (th. 6) et poursuivez la cuisson pendant encore 45 min."", ""Préparez la sauce rousse : faites fondre le beurre dans une petite casserole sur feu doux. Jetez-y la farine, remuez 3 min pour la cuire et la dorer légèrement. Mouillez avec un bol d'eau chaude dans lequel vous aurez dilué la tablette de bouillon. Salez,poivrez, amenez à ébullition tout en remuant. Ajoutez le vinaigre de la marinade et laissez cuire 20 min en remuant souvent. Au moment de servir, ajoutez le madère."", ""Au sortir du four, faites couler 3 ou 4 cuillerées de sauce rousse par la cheminée, puis retirez celle-ci. Servez chaud accompagné de sauce rousse en saucière.""]",https://www.hachette-vins.com/uploads/media/cache/thumb_medium/uploads/media/recettes/0001/05/9c2c3756818dbb2c1f0745b527da19dce6bcb42a.jpeg,826,8 pers.,01H05,00:55,"Un plat croustillant et riche, dans lequel l'équilibre de saveurs s'appuie sur l'acidité du vinaigre et la force aromatique du Madère."
1292,Papillotes de cabillaud,"[""-  2 filets de cabillaud de 400 g"", ""-  4 grosses crevettes"", ""-  1 courgette de 100 g environ"", ""-  1 crottin de chèvre mi"", ""- frais"", ""-  1 bouquet de basilic"", ""-  2 cuil. à soupe d'huile d'olive"", ""-  Sel, poivre du moulin""]","[""Lavez la courgette, retirez les deux extrémités et coupez-la en rondelles sans la peler. Effeuillez le basilic. Coupez le chèvre en dés."", ""Versez 75 cl d'eau dans l'autocuiseur. Mettez les rondelles de courgette dans le panier à vapeur et déposez-le dans l'autocuiseur. Fermez et faites cuire 6 min. Hors du feu, faites tomber la pression et laissez refroidir."", ""Mettez de côté 4 feuilles de basilic et mixez les autres avec la courgette, l'huile, les dés de chèvre, un peu de sel et de poivre."", ""Lavez les filets de cabillaud et coupez-les en deux. Préparez quatre feuilles d'aluminium ménager où vous répartirez le coulis de courgette. Posez chaque demi-filet de poisson sur le coulis et surmontez-le d'une crevette. Fermez les papillotes et posez-les sur le panier à vapeur de l'autocuiseur."", ""Versez dans l'autocuiseur 70 cl d'eau et déposez le panier. Fermez l'autocuiseur et faites cuire 8 min. Hors du feu, faites tomber la pression et déposez une papillote ou bien son contenu, dans chaque assiette. Servez aussitôt.""]",https://www.hachette-vins.com/uploads/media/cache/thumb_medium/uploads/media/recettes/0001/05/a638b463554616d7b2f7c58992492dc9ab9b32e9.jpeg,816,4 pers.,00H10,00:14,"Un plat diététique, iodé, offrant une texture ferme et effeuillée grâce au poisson. Le végétal de la courgette fait ressortir les amertumes du vin soutenu par l'huile d'olive."
1293,Morue aux haricots,"[""-  800 g de filets de morue dessalée"", ""-  250 g de haricots blancs secs"", ""-  25 g de beurre"", ""-  2 oignons hachés"", ""-  4 gousses d'ail écrasées"", ""-  2 bouquets garnis(thym frais, laurier, persil plat)"", ""-  1 cuil. à soupe de persil plat haché"", ""-  1/2 sachet de croûtons à l'ail"", ""-  3 cuil. à soupe d'huile d'olive"", ""-  Sel, poivre du moulin""]","[""Mettez les haricots dans une casserole, couvrez-les largement d'eau non salée. Ajoutez 1 bouquet garni puis portez à ébullition et faites cuire doucement de 1 h 30 à 2 h."", ""Mettez la morue dans une casserole et couvrez d'eau. Portez à ébullition à feu doux et retirez du feu dès les premiers frémissements. Égouttez les filets, retirez les arêtes, puis coupez chaque filet en morceaux."", ""Faites chauffer le beurre et l'huile à feu doux dans une sauteuse et faites-y revenir les oignons et l'ail 5 min sans les laisser brunir. Mouillez avec 10 cl du jus de cuisson des haricots et ajoutez à la sauce 2 cuillerées à soupe de haricots écrasés à la fourchette pour l'épaissir, l'autre bouquet garni et du poivre."", ""Ajoutez le reste des haricots à la sauce et posez les morceaux de morue sur les haricots. Ajoutez au besoin un peu du jus de cuisson des haricots et laissez bouillir très doucement pendant 15 min. Rectifiez l'assaisonnement en sel et incorporez le persil. Disposez la morue et les croûtons par-dessus et servez.""]",https://www.hachette-vins.com/uploads/media/cache/thumb_medium/uploads/media/recettes/0001/05/4b406b50b6601270c6ce2c88cad6c6d3b41fb630.jpeg,816,4 pers.,02H15,-,"Un plat traditionnel tout en simplicité, d'origine portugaise. Le goût du poisson est prononcé, la texture est complétée par la fécule du haricot et l'ail donne du corps à l'ensemble."
1294,Saint-Jacques aux champignons et parmesan,"[""-  8 noix de Saint"", ""- Jacques"", ""-  300 g de champignons de Paris"", ""-  1 grosse échalote"", ""-  1 bouquet de persil"", ""-  1 noix de beurre"", ""-  30 cl de crème fraîche liquide et légère"", ""-  3 jaunes d'œufs"", ""-  60 g de parmesan râpé"", ""-  Noix muscade"", ""-  4 cuil. à café de chapelure fine (facultatif)""]","[""Détachez les noix de Saint-Jacques de leur coquille et rincez-les."", ""Lavez les champignons et hachez-les, épluchez et ciselez l'échalote, hachez le persil. Faites revenir l'échalote et les champignons dans une poêle avec le beurre. Une fois que l'eau s'est évaporée, ajoutez la crème et laissez mijoter à feu doux 5 min. Ajoutez ensuite le persil et les jaunes d'oeufs, mélangez bien le tout, saupoudrez de muscade, salez et poivrez."", ""Placez les noix de Saint-Jacques dans 4 coquilles ou 4 cassolettes, recouvrez-les de sauce et saupoudrez-les de parmesan. Passez-les 10 min au four à 180 °C (th. 6). Servez chaud avec du riz.""]",https://www.hachette-vins.com/uploads/media/cache/thumb_medium/uploads/media/recettes/0001/05/fdcfcf194148c7c32dbcd254e5455c9ad6abe502.jpeg,817,4 pers.,00H20,00:20,"Un classique, un plat à l'ancienne qui se caractérise par une sauce prédominante et par l'influence du champignon. Le vin aura double fonction : d'abord révéler par son corps l'éclat aromatique de la saint-jacques associée aux champignons ; ensuite alléger la préparation par un apport d'acidité."
1298,Ratatouille niçoise,"[""-  500 g d'aubergines"", ""-  500 g de poivrons"", ""-  500 g de courgettes"", ""-  500 g d'oignons"", ""-  750 g de tomates"", ""-  4 gousses d'ail"", ""-  1 petite branche de thym frais"", ""-  1 branche de basilic frais"", ""-  10 cuil. à soupe d'huile d'olive"", ""-  Sel, poivre du moulin""]","[""Lavez les courgettes et les aubergines, coupez-les en rondelles sans les peler. Retirez la queue, les graines et les filaments des poivrons, coupez-les en fines rondelles. Pelez et écrasez l'ail. Épluchez les oignons, coupez-les en morceaux. Pelez, épépinez les tomates, hachez-les grossièrement."", ""Faites chauffer 2 cuillerées à soupe d'huile à feu doux, dans une sauteuse et faites-y cuire les aubergines 10 min, en les remuant de temps en temps. Retirez les aubergines et mettez-les de côté."", ""Versez dans la sauteuse 2 autres cuillerées à soupe d'huile, ajoutez les courgettes et faites-les cuire 10 min. Mettez-les de côté. Procédez de même pour les poivrons, puis pour les oignons."", ""Versez le reste d'huile dans une cocotte à fond épais. Ajoutez-y tous les légumes revenus, les tomates, le thym émietté et les feuilles de basilic frais. Salez et poivrez."", ""Laissez mijoter à feu très doux, couvercle entrouvert, pendant 2 h environ. Si le liquide de cuisson vous semble alors trop important, retirez le couvercle. Ôtez l'huile qui peut surnager à la surface et servez chaud ou froid. Plus vous ferez mijoter la ratatouille, plus elle sera savoureuse.""]",https://www.hachette-vins.com/uploads/media/cache/thumb_medium/uploads/media/recettes/0001/05/31b3b6b4580e9cb6f43da3f09bc1158e571cdf5f.jpeg,822,6 pers.,03H00,-,"Une garniture des plus classiques où le compoté règne sur un fond de tomate envahissant, une texture en douceur avec les fibres appréciables des légumes."
1299,Riz à la mexicaine (tomate et petits pois),"[""-  350 g de riz longs grains étuvés"", ""-  2 tomates"", ""-  1 carotte"", ""-  2 gousses d'ail"", ""-  1 oignon"", ""-  2 cuil. à soupe de concentré de tomate"", ""-  50 g de petits pois en boîte égouttés"", ""-  5 cl d'huile"", ""-  Sel""]","[""Lavez les légumes. Épluchez la carotte et coupez-la en petits dés. Pelez l'oignon et les gousses d'ail. Hachez-les finement."", ""Ôtez le pédoncule des tomates et entaillez-les en croix. Portez à ébullition une grande casserole d'eau. Mettez les tomates 10 secondes dans l'eau bouillante, puis arrêtez leur cuisson en les plongeant immédiatement dans de l'eau froide. Ôtez la peau des tomates. Coupez-les en quatre et ôtez les pépins. Concassez alors la chair des tomates et réservez."", ""Dans une casserole, faites chauffer 55 cl d'eau. Ajoutez-y l'oignon, l'ail, la tomate et le concentré de tomate. Salez, portez à ébullition et réservez hors du feu."", ""Dans une sauteuse, faites chauffer l'huile. Faites-y brièvement revenir le riz jusqu'à ce qu'il soit translucide. Ajoutez alors les dés de carotte et les petits pois. Mélangez, puis mouillez avec le bouillon à la tomate."", ""Portez le tout à ébullition et couvrez. Laissez cuire, à feu doux, pendant environ 20 min, jusqu'à ce que le riz soit cuit et le bouillon complètement absorbé. Laissez reposer le riz une dizaine de minutes avant de le servir.""]",https://www.hachette-vins.com/uploads/media/cache/thumb_medium/uploads/media/recettes/0001/05/e22840f78e0505c232760e95b237185117284953.jpeg,828,6 pers.,00H20,00:30,"Avant tout une garniture, ce style de riz n'influe pas particulièrement sur le choix du vin. Il faudra s'appuyer sur le mets principal pour des accords pertinents. Toutefois un rosé du Sud sera plus cohérent qu'un classique bordeaux rouge. On optera ici pour les mêmes vins que ceux proposés pour le risotto à la tomate."
1300,Soupe aux moules,"[""-  1 kg de moules"", ""-  1 bouquet d'oseille"", ""-  40 g de beurre"", ""-  2 jaunes d'œufs"", ""-  20 cl de crème fraîche"", ""-  2 cuil. à soupe de farine"", ""-  1 feuille de laurier"", ""-  1 branche de thym"", ""-  20 cl de vin blanc"", ""-  Sel, poivre du moulin""]","[""Grattez les moules, lavez-les à grande eau et mettez-les dans un faitout avec le vin blanc, le thym et le laurier. Faites-les ouvrir à feu vif. Lorsqu'elles sont toutes ouvertes, sortez-les des coquilles. Filtrez le liquide de cuisson à travers une passoire tapissée d'une gaze."", ""Rincez l'oseille et hachez-la. Faites fondre 20 g de beurre dans une casserole et faites-y fondre l'oseille 3 ou 4 min."", ""Faites fondre le reste du beurre, ajoutez la farine, mélangez, arrosez avec le jus de cuisson des moules et complétez avec de l'eau pour obtenir 1 litre de liquide. Portez doucement à ébullition."", ""Mélangez les jaunes d'oeufs à la crème, versez ce mélange dans la casserole, ajoutez les moules et l'oseille et faites chauffer doucement, sans laisser bouillir. Goûtez et rectifiez l'assaisonnement. Servez très chaud.""]",https://www.hachette-vins.com/uploads/media/cache/thumb_medium/uploads/media/recettes/0001/05/83120c8ed32288e984239c814633953d2057ba55.jpeg,840,4 pers.,00H05,00:30,"Avec ce velouté, un vin devient intéressant si l'on garde des moules en garniture."
1301,Tarte au fromage de chèvre et aux figues,"[""-  1 pâte feuilletée au beurre"", ""-  400 g de fromage de chèvre en tranches, à fondre"", ""-  750 g de figues fraîches ou 500 g de figues sèches + 1 cuil. à soupe de cognac"", ""-  30 g de beurre"", ""-  100 g de noix décortiquées"", ""-  4 cuil. à soupe de ciboulette ciselée"", ""-  10 cl de crème liquide"", ""-  2 cuil. à soupe de farine"", ""-  1/2 cuil. à café de cannelle en poudre"", ""-  Sel, poivre""]","[""Garnissez de pâte feuilletée un moule à tarte en appuyant bien sur le fond et le bord. Gardez au frais le temps de la préparation. Allumez le four à 200 °C (th. 7)."", ""Coupez les figues en deux si elles sont fraîches et faites-les revenir à feu doux 5 min dans le beurre. Si elles sont sèches, trempez-les 2 h à l'avance dans un bol d'eau aromatisée avec 1 cuillerée de cognac. Égouttez-les, coupez-les en deux et faites-les cuire dans le beurre. Après 5 min de cuisson, saupoudrez-les de cannelle et donnez un tour de moulin à poivre."", ""Garnissez le fond de la tarte de tranches de fromage de chèvre, saupoudrez de farine, ajoutez les morceaux de figues, la crème liquide, puis la ciboulette."", ""Salez, poivrez, décorez de cerneaux de noix et enfournez pour 25 min. Servez tiède avec une salade verte ou une salade de concombre bien relevée.""]",https://www.hachette-vins.com/uploads/media/cache/thumb_medium/uploads/media/recettes/0001/05/fbb56ed0c7036afd4b882b37dff0fe32cfc38eb2.jpeg,820,6 pers.,00H15,00:30,"Un plat très tendance, équilibré et plein de sensations : salé et acidité du fromage, douceur et fruité graineux de la figue."
1302,Soupe de poissons,"[""-  1 kg de poissons variés, vidés et nettoyés"", ""-  2 crabes"", ""-  2 carottes"", ""-  2 poireaux"", ""-  1 morceau de giraumon (ou de potiron)"", ""-  3 tomates"", ""-  2 citrons (jaunes ou verts)"", ""-  1 gros oignon"", ""-  2 gousses d'ail"", ""-  1 bouquet garni"", ""-  1 verre de vin blanc sec"", ""-  1 pincée de piment en poudre"", ""-  Sel, poivre du moulin""]","[""Préparez le liquide de macération en mélangeant le jus des 2 citrons, le vin blanc sec, les 2 gousses d'ail pelées et pressées, le piment en poudre et du sel."", ""Lavez les poissons, coupez-les en morceaux, et laissez-les mariner 1 h dans le liquide précédent en remuant de temps en temps."", ""Mettez les crabes et les morceaux de poisson (sans la marinade) dans une cocotte. Couvrez d'eau à hauteur et laissez cuire environ 20 min."", ""Retirez les poissons et les crabes de la cocotte à l'aide d'une écumoire. Égouttez les morceaux de poisson, puis prélevez-en la chair. Mettez les plus beaux morceaux à part. Décortiquez les crabes et récupérez la chair."", ""Nettoyez les poireaux, coupez-les en tronçons. Pelez les carottes, coupez-les en rondelles ; épluchez le giraumon et coupez-le en cubes. Pelez l'oignon. Lavez les tomates, et coupez leur chair en morceaux."", ""Filtrez le bouillon de cuisson au-dessus d'une casserole, puis mettez-y les différents légumes et le bouquet garni. Laissez cuire environ 20 min."", ""Lorsque les légumes sont cuits, retirez le bouquet garni. Ajoutez la chair des crabes et les morceaux de poisson. Passez le tout à la moulinette."", ""Versez la soupe dans une soupière. Présentez-la avec les beaux morceaux de poisson réservés et accompagnée éventuellement de croûtons de pain frits.""]",https://www.hachette-vins.com/uploads/media/cache/thumb_medium/uploads/media/recettes/0001/05/a5c4acc1c7cb2c608dcfc0729892114ad1dacbb3.jpeg,840,4 pers.,00H01,00:40,"Cette recette a l'avantage de marier les textures. Si vous avez choisi des poissons nobles, améliorez également le choix des vins. Pour des poissons courants, vous pouvez vous reporter aux suggestions proposées pour la soupe de moules ("
1303,Purée de potiron aux œufs brouillés et à la ciboulette,"[""-  2 kg de potiron"", ""-  4 gousses d'ail"", ""-  16 œufs"", ""-  1 botte de ciboulette"", ""-  50 cl de crème fraîche épaisse entière"", ""-  50 g de beurre"", ""-  1 cuil. à café de mélange d'épices garam masala"", ""-  Sel, poivre""]","[""Épluchez le potiron et coupez-le en morceaux. Épluchez l'ail et hachez-le. Coupez la ciboulette en petits morceaux, mais gardez-en quelques brins entiers pour la décoration. Faites cuire le potiron à la vapeur pendant 20 min."", ""Pendant ce temps, cassez les oeufs dans un saladier ; ajoutez la moitié de la crème en mélangeant. Dans une grande casserole, faites fondre le beurre. Ajoutez les oeufs, du sel et du poivre et faites cuire à feu moyen sans cesser de remuer à l'aide d'un fouet. Quand les oeufs sont cuits (ils doivent rester crémeux), retirez-les immédiatement du feu et versez-les dans un saladier. Continuez à fouetter et ajoutez le reste de crème fraîche et la ciboulette. Rectifiez l'assaisonnement."", ""Passez le potiron au moulin à légumes, salez, poivrez puis ajoutez les épices. Déposez un peu de purée de potiron sur les assiettes, puis, au centre, répartissez les oeufs brouillés et décorez avec la ciboulette.""]",https://www.hachette-vins.com/uploads/media/cache/thumb_medium/uploads/media/recettes/0001/05/c8f1ce3cb448d621f73a14268c78a5b0ed91dcd7.jpeg,837,-,-,-,""
1304,Poulet au cidre,"[""-  1 poulet de 1,6 kg coupé en morceaux"", ""-  6 pommes fruits"", ""-  30 cl de cidre brut"", ""-  20 g de beurre"", ""-  15 cl de crème fraîche épaisse"", ""-  Noix muscade"", ""-  Sel, poivre du moulin""]","[""Faites fondre le beurre dans une cocotte et faites-y dorer les morceaux de poulet. Salez et poivrez, puis arrosez avec le cidre."", ""Couvrez la cocotte et laissez cuire 45 min à feu doux."", ""Pelez les pommes et coupez-les en lamelles épaisses."", ""Incorporez la crème fraîche au jus de cuisson du poulet, puis ajoutez les pommes ainsi qu'un peu de noix muscade râpée, et laissez cuire encore 20 min. Servez brûlant.""]",https://www.hachette-vins.com/uploads/media/cache/thumb_medium/uploads/media/recettes/0001/05/996ce976c602a001e382c061c023381dc4984cad.jpeg,815,6 pers.,01H15,-,Un beau classique oublié en dehors de la Bretagne et de la Normandie. Le cidre nourrit ce plat à l'équilibre acidulé-sucré-crémeux ; la chair du poulet reste ferme. Le cidre ou le poiré bruts offrent la meilleure association.
1305,Risotto au thé et fruits secs,"[""-  Le jus de 1 citron"", ""-  1 cuil. à soupe de zeste de citron râpé"", ""-  30 g de beurre"", ""-  25 cl de crème liquide"", ""-  250 g de riz à grains ronds"", ""-  4 sachets de thé de Ceylan"", ""-  125 g de sucre en poudre"", ""-  2 cuil. à soupe de rhum"", ""-  300 g de pruneaux dénoyautés"", ""-  50 g de raisins blonds secs"", ""-  30 g de cerneaux de noix""]","[""Faites chauffer 1 litre d'eau dans une casserole. Dès que l'eau commence à frémir, ôtez la casserole du feu et faites infuser les sachets de thé 3 min."", ""Retirez les sachets et ajoutez le zeste et le jus de citron au thé. Remettez la casserole sur le feu, portez à ébullition, et maintenez à petits frémissements."", ""Dans une cocotte à fond épais, faites fondre le beurre à feu moyen. Versez le riz et tournez-le pour enrober les grains de beurre, puis ajoutez les pruneaux et les raisins."", ""Versez une louche de thé et laissez cuire à petits frémissements en tournant plusieurs fois jusqu'à ce que tout le thé soit absorbé par le riz. Poursuivez en ajoutant le thé louche après louche. Incorporez le sucre et le rhum avant de verser la dernière louche."", ""Incorporez la crème et les cerneaux de noix au risotto et ôtez-le du feu. Servez tiède ou froid.""]",https://www.hachette-vins.com/uploads/media/cache/thumb_medium/uploads/media/recettes/0001/05/3a9822047b18b533a24144986b5eed49c4e9853e.jpeg,821,-,-,-,"Un mets onctueux et consistant, qui peut se comparer au riz gluant asiatique. Le vin peut offrir un apport aromatique complémentaire du thé et des fruits secs."
1306,Tiramisu,"[""-  3 œufs"", ""-  250 g de mascarpone en boîte (fromage blanc italien)"", ""-  24 biscuits à la cuiller"", ""-  50 g de sucre"", ""-  25 cl de café fort, refroidi"", ""-  1 cuil. à soupe d'extrait de café"", ""-  2"", ""- 3 cuil. à soupe de cacao"", ""-  sel""]","[""Cassez les oeufs en séparant les blancs des jaunes. Mettez les jaunes dans une jatte, versez les blancs dans un grand bol."", ""Ajoutez le sucre aux jaunes d'oeufs et battez avec un fouet à main jusqu'à ce que le mélange pâlisse et mousse."", ""Ajoutez alors le mascarpone et continuez à fouetter pour obtenir un mélange homogène. Mettez au réfrigérateur pendant que vous battez les blancs."", ""Ajoutez 1 pincée de sel aux blancs d'oeufs et battez-les en neige ferme. Incorporez-les délicatement au mélange précédent, avec une cuillère à soupe, en remuant délicatement la préparation de haut en bas, toujours dans le même sens. Remettez au réfrigérateur."", ""Versez le café et l'extrait de café dans une assiette creuse. Mélangez. Trempez rapidement la face non sucrée de 12 biscuits à la cuiller dans ce mélange, un à la fois, et rangez-les au fur et à mesure, côte à côte, dans un joli plat à gratin rectangulaire"", ""Recouvrez les biscuits avec la moitié de la mousse. Couvrez entièrement avec 1 grosse cuillerée à soupe de cacao, en le tamisant dans une passoire fine."", ""Trempez le reste des biscuits dans le café et déposez-les au-dessus. Recouvrez du reste de la mousse. Lissez avec une spatule et laissez au moins 3 h au frais."", ""Au moment de servir, sortez le tiramisù du réfrigérateur et poudrez-le avec le reste du cacao, en le tamisant dans la passoire.""]",https://www.hachette-vins.com/uploads/media/cache/thumb_medium/uploads/media/recettes/0001/05/43ef6ef08d0758b98f5978eef1bacb193991b18d.jpeg,839,6 pers.,00H30,-,"Un dessert fondant et ferme, à la texture élégante. La base aromatique s'appuie sur la torréfaction mais est d'influence très mesurée. L'amertume prolonge la rémanence de ce classique. Un accord sensible en perspective : avec l'effervescence, on relève l'amertume du vin ou du dessert ; avec un vin doux, on étouffe le raffinement de l'entremet. Il faut privilégier le café. On peut également servir un café du Kenya ou du Costa Rica."
1307,Velouté de concombre à la menthe et pommes de terre au curry,"[""-  100 g de pommes de terre à chair ferme"", ""-  4 cuil. à soupe d'huile d'olive"", ""-  1 cuil. à soupe rase de curry"", ""-  2 concombres"", ""-  Le jus de 1 citron"", ""-  3 yaourts grecs"", ""-  25 cl de lait fermenté"", ""-  1 bouquet de menthe"", ""-  Sel, poivre du moulin""]","[""Lavez les pommes de terre et placez-les dans une casserole d'eau froide salée. Mettez sur le feu et laissez cuire 15 min à compter de l'ébullition. Passez-les sous l'eau froide et égouttez. Quand les pommes de terre sont froides, pelez-les et coupez-les en cubes. Versez l'huile d'olive et le curry dans un bol et mettez les cubes de pommes de terre à mariner le temps de préparer le velouté de concombre."", ""Lavez les concombres et essuyez-les. Coupez-les en tronçons et versez dans le bol du mixer. Ajoutez le jus de citron, les yaourts grecs, le lait fermenté et les feuilles de menthe préalablement lavées. Mixez pour obtenir un mélange lisse et onctueux. Salez et poivrez."", ""Versez dans des bols et répartissez les cubes de pommes de terre marinées. Servez bien frais.""]",https://www.hachette-vins.com/uploads/media/cache/thumb_medium/uploads/media/recettes/0001/05/e21889562677e3a7f22a83fbe49e3f7953fdf4e7.jpeg,840,4 pers.,00H15,00:20,"Un mets velouté grâce au yaourt et à l'huile d'olive, et l'acidité donne du corps à la préparation. La pomme de terre ne favorise pas l'accord, déjà difficile sur le principe. Privilégiez un vin envisageable sur le plat suivant. Vous pouvez toutefois ouvrir un vin jaune du Jura ou un xérès Fino ou Manzanilla très frais."
