id,name,ingredients,preparation,image,category_id,proportion,time_prep,time_cook,description
787,Aiguillettes de canard aux mirabelles,"[""-  2 magrets de canard"", ""-  150 g de foie gras de canard cru"", ""-  1 bouquet de cerfeuil"", ""-  125 g de crème fraîche"", ""-  25 g de beurre"", ""-  250 g de mirabelles en conserve"", ""-  1 cuil. à soupe de vinaigre de Xérès"", ""-  1 verre de porto"", ""-  1 cuil. à soupe d'huile de tournesol"", ""-  Sel, poivre du moulin""]","[""Dans une sauteuse, faites chauffer l'huile et saisissez les deux magrets, environ 4 ou 5 min de chaque côté. Coupez-les en aiguillettes et gardez-les au chaud."", ""Faites fondre le beurre dans une poêle et mettez-y à revenir 3 min le foie gras cru coupé en morceaux."", ""Ajoutez le vinaigre de Xérès, puis le porto. Écrasez le foie gras à la fourchette ou au mixer 2 min."", ""Ajoutez la crème fraîche, mélangez bien. Versez dans la poêle les mirabelles et assaisonnez de sel et de poivre à votre goût."", ""Faites réchauffer les aiguillettes et les mirabelles dans la crème 3 min à feu doux avant de servir."", ""Servez aussitôt. Vous pouvez décorer votre plat avec quelques brins de cerfeuil.""]",https://www.hachette-vins.com/uploads/media/cache/thumb_medium/uploads/media/recettes/0001/05/fbd4f25a25ff68f96a722a037e829c94b4db046f.jpeg,815,4 pers.,00H10,00:20,"Gibier à plumes, à Cuisson assez courte associée à l'onctuosité du foie gras, la crème et le Porto. Grâce au vinaigre, le plat s'équilibre avec caractère. Choisir un vin corsé avec la couleur correspondante au choix et type de Porto. L'accord Porto (par exemple un Tawny 20 ans d'âge) est la solution de facilité."
790,Bœuf bourguignon,"[""-  1,2 kg de bœuf dans le jumeau et la pointe de paleron"", ""-  150 g de poitrine de porc fraîche ou demi"", ""- sel"", ""-  300 g de champignons de Paris"", ""-  250 g de petits oignons grelots pelés"", ""-  4 carottes"", ""-  4 oignons"", ""-  4 gousses d'ail"", ""-  1 bouquet garni"", ""-  75 cl de bourgogne rouge"", ""-  1 tablette de bouillon de bœuf"", ""-  100 g de beurre"", ""-  2 cuil. à soupe d'huile"", ""-  3 cuil. à soupe de farine"", ""-  1 cuil. à soupe de sucre en poudre"", ""-  Sel, poivre du moulin\r\n \r\nRecette extraite du livre Viandes de Jean"", ""- François Mallet""]","[""Coupez la poitrine de porc avec la couenne en petits lardons. Coupez la viande de boeuf en gros dés."", ""Dans une poêle, faites rissoler à feu vif dans 2 cuillerées à soupe d'huile les morceaux de viande de boeuf de tous côtés, jusqu'à ce qu'ils brunissent."", ""Rangez les morceaux de viande au fur et à mesure dans une grande cocotte. Saupoudrez de sucre et faites caraméliser."", ""Ajoutez 50 g de beurre et la farine. Faites roussir la farine jusqu'à ce qu'elle ait la couleur du caramel foncé. Allumez le gril du four."", ""Épluchez les carottes, coupez-les en rondelles. Pelez les oignons et hachez-les. Mettez ces légumes dans la cocotte. Salez, poivrez et glissez la cocotte dans le four. Laissez encore brunir viandes et légumes 10 min sous le gril."", ""Mouillez avec le vin. Pelez, écrasez et ajoutez l'ail, puis la tablette de bouillon, le bouquet garni ainsi que 40 cl d'eau. Portez à ébullition tout en remuant, puis couvrez et laissez mijoter 3 h à feu doux en remuant de temps en temps."", ""Pendant ce temps, faites blondir à feu doux les lardons dans une sauteuse avec 50 g de beurre. Nettoyez les champignons et ajoutez-les avec les oignons grelots dans la sauteuse. Salez, poivrez, couvrez et laissez cuire 15 min tout en remuant fréquemment."", ""Pour servir, disposez le boeuf bourguignon dans un plat de service, entourez-le de la garniture et servez, accompagné de pommes de terre ou de pâtes.""]",https://www.hachette-vins.com/uploads/media/cache/thumb_medium/uploads/media/recettes/0001/05/78eb6c615ffe2db31e8ad945eeecb599faf56e6d.jpeg,818,6 pers.,01H00,03:00,"Un bon classique dans les ragoûts, avec une sauce assez corsée par sa réduction. Carottes et oignons apportent de l'onctuosité à ce plat plutôt riche. Privilégiez un vin rouge ample et velouté, aux tanins fins, si possible patinés par un peu de garde. L'accord régional s'impose immédiatement : un"
788,Boulettes de poisson,"[""-  750 g de poisson à chair blanche (daurade, merlan...)"", ""-  100 g de riz"", ""-  1 œuf"", ""-  1 gros oignon"", ""-  5 gousses d'ail"", ""-  1 bouquet de persil"", ""-  1 feuille de laurier"", ""-  1/2 cuil. à café de curcuma"", ""-  1/4 cuil. à café de noix de muscade"", ""-  8 cuil. à soupe d'huile d'olive"", ""-  Sel, poivre du moulin""]","[""Ôtez les arêtes du poisson. Épluchez l'oignon et rincez le persil. Mettez tous ces ingrédients dans le bol d'un robot et mixez-les ensemble."", ""À ce mélange, ajoutez l'oeuf, le riz, la noix muscade, du sel et du poivre. Mélangez bien le tout et formez, avec les doigts, des boulettes de 4 cm de diamètre environ."", ""Dans une marmite, versez l'huile d'olive et 1 verre d'eau (20 cl), ajoutez ensuite le curcuma, l'ail pelé et coupé en rondelles et le laurier. Salez, poivrez et portez à ébullition."", ""Jetez alors les boulettes, une à une, dans la marmite, couvrez et laissez mijoter à feu moyen pendant 15 à 20 min. Disposez-les dans un plat avant de servir.""]",https://www.hachette-vins.com/uploads/media/cache/thumb_medium/uploads/media/recettes/0001/05/b570f230ebd73c9cafba4f2ee2ba5c3c7dd15442.jpeg,816,2 pers.,00H25,00:20,"Rustique par la texture des boulettes, ce met est méditerranéen par ses arômes. Le riz, quant à lui, appelle un vin de caractère, blanc en priorité, sec et généreux, ayant lui-aussi des qualités aromatiques suffisantes pour se hisser à hauteur du plat."
823,Veau au citron,"[""-  1,2 kg de noix de veau"", ""-  50 g de lardons maigres"", ""-  3 oignons"", ""-  2 carottes"", ""-  4 échalotes"", ""-  1 petit bouquet de persil plat"", ""-  1 gros citron à peau fine ou 2 petits"", ""-  20 cl de bouillon de pot"", ""- au"", ""- feu fait maison ou préparé avec un cube"", ""-  10 cl de madère"", ""-  25 g de beurre"", ""-  Sel, poivre blanc du moulin""]","[""Pelez les oignons et les échalotes, épluchez les carottes et lavez le citron ; coupez-les en fines rondelles. Lavez, essuyez et hachez le persil. Faites blanchir les lardons 1 min à l'eau bouillante, puis égouttez-les."", ""Enduisez le fond de l'autocuiseur avec le beurre. Déposez par-dessus les oignons, les échalotes et les carottes. Parsemez du persil et des lardons et ajoutez ensuite les rondelles de citron. Posez la noix de veau sur ce lit de légumes et de citron. Salez, poivrez et versez le bouillon et le madère. Fermez l'autocuiseur."", ""Faites chauffez à feu vif jusqu'au début de la mise sous pression de la soupape puis poursuivez la cuisson à feu doux le temps indiqué. Hors du feu, faites tomber la pression."", ""Posez la noix de veau entourée des légumes sur un plat de service chaud. Si la sauce paraît un peu claire, faites-la réduire à feu vif avant d'en napper la viande.""]",https://www.hachette-vins.com/uploads/media/cache/thumb_medium/uploads/media/recettes/0001/05/0b6df0c3d959648df5ae19f06cdff4e2e2e9cfe7.jpeg,826,6 pers.,00H25,01:00,Joli morceau que la noix de veau. Sa cuisson sur une garniture aromatique avec un vin de grand caractère offre toujours un excellent résultat.
1171,Pintade rôtie,[],[],"",815,"","","",""
1172,Risotto aux fruits de mer,[],[],"",828,"","","",""
1173,Pizza margherita,"[""- 1 pâte à pizza"", ""- 1 boule de mozzarella"", ""- 1 oignon"", ""- 3 feuilles de basilic"", ""- 5 bonnes cuil. à soupe de sauce tomate"", ""- 1 pincée de sucre"", ""- Origan"", ""- Parmesan râpé\r\nRecette extraite du livre Pizzas, quiches &amp; cakes de Emilie Perrin""]","[""Préchauffez le four à 220 °C (th. 7). Détaillez la mozzarella en morceaux. Pelez et émincez l’oignon. Ciselez le basilic."", ""Étalez la pâte à pizza soit en rectangle, soit en cercle puis disposez-la sur la plaque. Étalez la sauce tomate, parsemez de basilic, de sucre et d’origan."", ""Disposez l’oignon, la mozzarella et saupoudrez de parmesan râpé. Enfournez pour 15 min.""]",https://www.hachette-vins.com/uploads/media/cache/thumb_medium/uploads/media/recettes/0001/08/ebb79034402b68e0e9993144f6d1a6338cb817e7.jpeg,820,4 pers.,00H15,00:15,""
1174,Pigeonneaux rôtis,[],[],"",823,"","","",""
1175,Poularde de Bresse à la crème et aux morilles,[],[],"",815,"","","",""
1176,Soumaintrain,[],[],"",834,"","","",""
1177,Carré d'agneau rôti aux champignons,[],[],"",825,"","","",""
1178,Canard aux cerises,[],[],"",815,"","","",""
1179,Bar (ou loup) grillé,[],[],"",816,"","","",""
1180,Bécasse rôtie,[],[],"",823,"","","",""
1181,Bouchées à la reine,[],[],"",820,"","","",""
791,Cassolettes de moules au safran,"[""-  1 kg de moules de bouchot"", ""-  1 grosse échalote hachée"", ""-  3 branches de persil"", ""-  40 cl de vin blanc sec"", ""-  50 g de carottes"", ""-  50 g de céleri en branche"", ""-  1 noix de beurre"", ""-  2 cuil. à soupe de fumet de poisson déshydraté"", ""-  1 jaune d'œuf"", ""-  20 cl de crème fraîche liquide légère"", ""-  2 mini"", ""- dosettes de safran (soit 1/2 cuil. à café)"", ""-  Sel, poivre du moulin""]","[""Lavez et grattez les moules sans les faire tremper. Dans un faitout, réunissez l'échalote, le persil et le vin blanc. Laissez mijoter 5 min, puis ajoutez les moules. Une fois celles-ci ouvertes, laissez-les mijoter encore 3 min après les avoir remuées de façon à ce qu'elles cuisent uniformément. Sortez-les et retirez les coquilles, puis décortiquez-les et répartissez-les dans les cassolettes. Filtrez le liquide de cuisson à l'aide d'un chinois ou d'une très fine passoire et réservez-le."", ""Préchauffez le four à 180 °C (th. 6). Coupez les carottes et le céleri en fine julienne (bâtonnets très fins). Dans une casserole, mettez le beurre et faites-y suer les carottes 5 min. Diluez le fumet de poisson dans 1/4 de litre d'eau et versez-le sur les carottes. Portez à ébullition, ajoutez le jus de cuisson des moules et laissez réduire pendant 10 min environ. Battez le jaune d'oeuf, la crème et le safran, puis versez le tout dans le fumet. Salez, poivrez et recouvrez les moules de cette Préparation. Passez 10 min au four et servez aussitôt.""]",https://www.hachette-vins.com/uploads/media/cache/thumb_medium/uploads/media/recettes/0001/05/077cb9fdfb6f8526f1cde1a4bf2a53af69d122ae.jpeg,817,4 pers.,00H25,00:25,"Un classique simple, iodé et crémé, qui s'accorde à tous les blancs. Le goût de la carotte un peu safranée facilite aussi l'accord avec des blancs plutôt méditerranéens et pourquoi pas rosés. Privilégiez un vin blanc sec avec du volume, de la rondeur et une pointe de vivacité ("
793,Filets de sole bonne-femme,"[""-  150 g de champignons de Paris"", ""-  1 échalote"", ""-  1 cuil. à café de persil haché"", ""-  10 cl de vin blanc sec"", ""-  800 g de filets de sole"", ""-  20 cl de crème liquide légère"", ""-  70 g de beurre""]","[""Réalisez un fumet de poisson, puis dans une grande poêle à hauts rebords, étalez les champignons lavés et coupés en lamelles, l'échalote, le persil et le vin blanc. Déposez les filets de sole sur les champignons et versez le fumet de poisson filtré. Recouvrez le tout d'un papier sulfurisé et laissez cuire à feu doux pendant 8 min."", ""Retirez les filets de la poêle, puis versez la crème et laissez réduire de moitié. Hors du feu ou à feu très doux, ajoutez le beurre par petits morceaux, tout en remuant à l'aide d'un fouet pour que la sauce monte."", ""Disposez les filets dans les cassolettes, recouvrez de sauce et passez au gril pour faire dorer. Servez chaud.""]",https://www.hachette-vins.com/uploads/media/cache/thumb_medium/uploads/media/recettes/0001/05/1f43636741a605b090abf31740fbd5e65db6d713.jpeg,816,4 pers.,00H30,00:25,Un grand classique de la cuisine traditionnelle. La présence des champignons influence l'accord. La qualité des soles et la cuisson jouent également un rôle important. On optera pour
1182,Tournedos Rossini,[],[],"",818,"","","",""
1183,Sandre au beurre blanc,[],[],"",816,"","","",""
1184,Côtes de veau à la crème,[],[],"",826,"","","",""
1185,Navarin d'agneau,"[""- 2 kg d’épaule d’agneau"", ""- 4 oignons"", ""- 4 gousses d’ail"", ""- 800 g de tomates"", ""- 300 g de petits champignons de Paris"", ""- 1 botte de ciboulette"", ""- 40 g de farine"", ""- 1 petit bouquet garni"", ""- 20 cl de vin blanc ou rosé"", ""- 1 cuil. à soupe de concentré de tomates"", ""- 1 brin de thym frais"", ""- 50 cl de fond de volaille"", ""- 5 cuil à soupe d’huile d’arachide"", ""- 4 cuil. à soupe d’huile d’olive"", ""- Sel, poivre du moulin\r\n \r\nRecette extraite du livre Cocottes &amp; mijotés"", ""-  Recettes gourmandes à réaliser à la maison de Stéphan Lagorce""]","[""Détaillez l’épaule d’agneau en morceaux et assaisonnez-les. Épluchez puis hachez les oignons et les gousses d’ail. Coupez les tomates en tranches. Nettoyez les champignons. Hachez la ciboulette."", ""Dans une grande cocotte, faites chauffer l’huile d’arachide à feu vif. Faites ensuite colorer les morceaux de viande pendant 10 min environ, puis saupoudrez-les de farine. Mélangez et poursuivez la cuisson encore 1 ou 2 min. Ajoutez les oignons et l’ail. Laissez cuire 5 min environ en mélangeant de temps en temps."", ""Ajoutez le bouquet garni, le vin, le concentré de tomates, les tranches de tomate, le thym et le fond de volaille. Couvrez et laissez mijoter à couvert pendant 1 h environ."", ""Dégraissez la sauce avec une cuillère puis ajoutez les champignons et comptez encore 40 min de cuisson. Finissez en ajoutant la ciboulette et l’huile d’olive. Salez et poivrez. Servez bien chaud.""]",https://www.hachette-vins.com/uploads/media/cache/thumb_medium/uploads/media/recettes/0001/09/ff2245ffa7fecde6a59afdd208c4462b716ccce1.jpeg,825,4 pers.,00H25,02:00,". Il suffit de choisir des rouges tendres et fruités, à l’image des crus du Beaujolais."
869,Camembert,[],[],"",834,"","","",""
796,Far aux pruneaux,"[""-  500 g de pruneaux"", ""-  100 g de raisins secs"", ""-  50 cl de thé chaud"", ""-  250 g de farine"", ""-  4 œufs"", ""-  40 cl de lait"", ""-  10 g de beurre pour le moule"", ""-  2 grosses cuil. à soupe de sucre"", ""-  2 cuil. à soupe de rhum"", ""-  1 pincée de sel""]","[""Dénoyautez les pruneaux, puis faites-les tremper 8 h dans le thé."", ""Préchauffez le four à 200 °C (thermostat 7). Arrosez les raisins avec le rhum."", ""Mélangez la farine, les oeufs, le sucre, le lait et le sel jusqu'à ce que la pâte soit bien lisse et sans grumeaux."", ""Égouttez les pruneaux, ajoutez-les à la pâte ainsi que les raisins et le rhum. Mélangez bien. Beurrez un moule à manqué en Pyrex de 24 cm de diamètre ou un plat à gratin. Versez-y la pâte et faites cuire 1 h au four."", ""Servez, tiède ou froid, dans le plat de cuisson.""]",https://www.hachette-vins.com/uploads/media/cache/thumb_medium/uploads/media/recettes/0001/05/39ebf84918e6daf6889f4c59acf8980a94d9d249.jpeg,821,8 pers.,01H30,-,"Dessert à base de pâte essentiellement, comparable à la texture de la génoise. Le principe est d'alléger ce plat et d'éviter l'ajout de sucre avec un vin liquoreux. On choisira donc plutôt un effervescent blanc ou rosé, ayant du corps et du bouquet. Les gourmands apprécieront quand même les vins de desserts. Un cidre doux conviendra également."
797,Daurade à la citronnelle,"[""-  1 dorade grise vidée (1,2 à 1,4 kg)"", ""-  2 tomates"", ""-  2 oignons nouveaux"", ""-  4 branches de citronnelle"", ""-  1 botte de coriandre"", ""-  1 botte de ciboulette"", ""-  1 piment rouge frais"", ""-  2 cuil. à soupe d'huile végétale"", ""-  Nuoc"", ""- mâm"", ""-  Sel, poivre""]","[""Préchauffez le four à 200 °C (th. 7). Hachez la citronnelle et les oignons nouveaux. Effeuillez la coriandre. Ébouillantez les tomates pour pouvoir ôter leur peau facilement. Épépinez-les et coupez-les en petits cubes. Hachez la ciboulette et le piment (après avoir retiré les graines)."", ""Dans un saladier, mélangez les trois quarts de la citronnelle aux oignons, à la tomate, à la ciboulette, au piment et aux trois quarts de la coriandre. Salez et poivrez. Farcissez la dorade de cette préparation."", ""Disposez la dorade dans un grand plat, incisez la peau et saupoudrez du reste de la citronnelle. Salez, poivrez et versez l'huile. Enfournez pendant 40 min. À la sortie du four, saupoudrez la dorade du reste des feuilles de coriandre et servez aussitôt accompagnée de riz blanc et de sauce nuoc-mâm.""]",https://www.hachette-vins.com/uploads/media/cache/thumb_medium/uploads/media/recettes/0001/05/d56ba22f07e32ea3513370d42f1a6fa69eec15cf.jpeg,816,4 pers.,00H20,00:40,"Une préparation simple mais un poisson fin et élégant. La citronnelle apporte une certaine fraîcheur. On choisira donc un vin plutôt blanc, sec et minéral, fin mais avec du corps ("
799,"Gratin de courge à la ricotta, au basilic et aux pignons de pin","[""-  2 courges butternut"", ""-  500 g de ricotta"", ""-  100 g de pignons de pin"", ""-  1 botte de basilic"", ""-  2 gousses d'ail"", ""-  3 cuil. à soupe d'huile d'olive"", ""-  Sel, poivre""]","[""Épluchez les courges et coupez-les en morceaux. Effeuillez le basilic et hachez-le. Épluchez l'ail et hachez-le. Préchauffez le four à 180 °C (th. 6)."", ""Faites cuire la courge 15 min à la vapeur pour éviter qu'elle ne se gonfle d'eau. Laissez-la ensuite s'égoutter pendant 15 min. Dans un grand saladier, mélangez l'ail, le basilic et la ricotta. Ajoutez la courge et mélangez à nouveau. Salez et poivrez."", ""Huilez un plat à gratin et versez-y la courge à la ricotta. Lissez le dessus et saupoudrez de pignons de pins. Enfournez pour 15 min (la pointe d'un couteau doit s'enfoncer sans résistance dans la courge). Servez immédiatement.""]",https://www.hachette-vins.com/uploads/media/cache/thumb_medium/uploads/media/recettes/0001/05/d9c0188059a5601bec4aae52e97f341ee7be03e7.jpeg,822,8 pers.,00H20,00:30,"C'est la ricotta qui justifie ici l'accord avec le vin. Optez pour un vin blanc de préférence, sec, aromatique, minéral et d'une belle vivacité."
800,Croustillants de caille,"[""-  12 feuilles de brick"", ""-  8 cailles"", ""-  4 pommes golden moyennes (pour la présentation)"", ""-  8 cuil. à soupe de compote de pomme non sucrée"", ""-  4 petits oignons"", ""-  400 g de raisin vert"", ""-  20 g de beurre"", ""-  1/4 de cuil. à café de gingembre"", ""-  8 cuil. à soupe d'huile de tournesol""]","[""Faites rôtir les cailles au four avec 2 cuillerées à soupe d'huile à 180 C (th. 5-6) pendant 25 à 30 min. Elles doivent être dorées et faciles à désosser. Laissez le four allumé."", ""Lavez, pelez et épépinez les raisins. Parfumez la compote avec le gingembre."", ""Dans une poêle, faites dorer les oignons coupés en lamelles."", ""Lorsque les cailles sont rôties, déchiquetez grossièrement la chair et réservez la sauce."", ""Dans une poêle, mélangez la compote, les oignons et les raisins. Laissez cuire pendant 3 min à feu doux. Versez les cailles et remuez délicatement."", ""Badigeonnez les feuilles de brick avec l'huile. Superposez-les trois par trois. Répartissez la farce au centre et repliez les côtés pour former 4 paquets de 10 cm de côté. Retournez-les et faites une incision en forme de croix sur le dessus à l'aide d'une paire de ciseaux."", ""Posez-les sur une plaque huilée allant au four. Faites cuire 10 min à 210 C (th. 7)."", ""Versez 1 cuillerée de sauce par l'ouverture de chaque croustillant."", ""Servez avec les pommes golden pelées, coupées en deux et cuites à la poêle dans le beurre.""]",https://www.hachette-vins.com/uploads/media/cache/thumb_medium/uploads/media/recettes/0001/05/c8b1ac623854e07910904e2b465d1a3f3c4ea2a1.jpeg,823,4 pers.,00H30,00:50,"Un plat de contrastes : du brick croustillant à la chair fine et ferme de la caille, de l'acidité de la golden à la douceur de la compote « envoilée » par le gingembre. Choisir un vin rouge aux tanins fins, un vin épanoui plutôt qu'un vin jeune et vigoureux, ou alors un vin tendre. Allez du côté de la Bourgogne ("
803,"Coquelet caramélisé, sauce au foie gras","[""-  2 coquelets de 600 g chacun (fendus en deux)"", ""-  1 tranche de 150 g de pâté de foie gras"", ""-  2 cuil. à soupe de crème fraîche épaisse"", ""-  2 cuil. à soupe de miel"", ""-  1 petit verre de rhum"", ""-  1 verre de bouillon"", ""-  1 cuil. à café de gingembre en poudre"", ""-  4 cuil. à soupe d'huile de tournesol"", ""-  1 cuil. à café de poivre"", ""-  Sel""]","[""Badigeonnez les coquelets avec un mélange de sel, de gingembre, de poivre et la moitié de l'huile. Laissez macérer 1 h."", ""Faites chauffer le reste de l'huile dans une cocotte. Faites-y dorer les coquelets 5 min, puis mouillez avec le bouillon. Laissez mijoter à feu doux 30 min."", ""Retirez les coquelets. Déglacez la cocotte avec le rhum, ajoutez le miel et laissez-le caraméliser."", ""Passez le pâté de foie gras au tamis et ajoutez-le dans la cocotte avec la crème fraîche. Remuez jusqu'à ce que la sauce soit bien liée."", ""Servez les coquelets avec la sauce et un légume de votre choix.""]",https://www.hachette-vins.com/uploads/media/cache/thumb_medium/uploads/media/recettes/0001/05/90edbec508a9e7bf921011b81e3447d3427dd74b.jpeg,815,4 pers.,00H10,00:45,"Les épices renforcent et pénètrent la chair tendre du coquelet. La sauce liée au foie gras permet d'envisager un vin dense et velouté. Les amateurs de rouge joueront sur l’harmonie des textures onctueuses et sur les arômes épicés, en choisissant un vin méridional rond et épicé. Côté blanc, le vin ne doit être ni trop svelte ni trop sec pour répondre à la richesse de la sauce. On le préférera demi-sec ou moelleux, et bien aromatique :"
802,Lapin chasseur,"[""-  1 lapin de 1,8 kg en morceaux"", ""-  500 g de champignons de Paris"", ""-  4 échalotes"", ""-  1 gousse d'ail"", ""-  10 cl de vin blanc sec"", ""-  5 cl de cognac"", ""-  1 cuil. à soupe de concentré de tomates"", ""-  1 cuil. à soupe d'huile"", ""-  25 g de beurre"", ""-  1 petit bouquet de persil plat"", ""-  Sel, poivre du moulin""]","[""Pelez les échalotes et la gousse d'ail, coupez les échalotes en rondelles fines et écrasez l'ail au presse-ail. Nettoyez les champignons et coupez-les en quatre. Lavez, épongez et hachez le persil."", ""Faites chauffer le beurre et l'huile à feu moyen dans l'autocuiseur, ajoutez les morceaux de lapin et faites-les dorer 2 ou 3 min en les retournant ; puis ajoutez les échalotes, l'ail et les champignons et faites-les revenir 2 min en remuant."", ""Versez le vin blanc, le cognac et 10 cl d'eau où vous aurez délayé le concentré de tomates. Salez et poivrez. Fermez l'autocuiseur et, dès la mise sous pression de la soupape, faites cuire à feu plus doux le temps indiqué."", ""Faites tomber la pression et gardez le lapin et les champignons au chaud. Faites au besoin réduire la sauce à feu vif, rectifiez l'assaisonnement et ajoutez le persil. Nappez le lapin de la sauce et servez.""]",https://www.hachette-vins.com/uploads/media/cache/thumb_medium/uploads/media/recettes/0001/05/9cf9cb037736c53eb15b26196e375745c424b7e4.jpeg,824,6 pers.,00H15,00:18,"Un plat simple et classique, à la chair goutteuse, préservée par le mode de cuisson étouffé. La sauce est nappante, la chair se détache délicatement, c'est tendre et savoureux. Choisir plutôt un vin rouge malgré la cuisson au vin blanc. L'acidité du blanc serait atténuée par le salé-sucré de la réduction de sauce. Le rouge jouera une plus belle carte s'il possède des tanins fins :"
