id,name,ingredients,preparation,image,category_id,proportion,time_prep,time_cook,description
808,Baeckeoffe,"[""-  400 g d'épaule de mouton coupée en cubes"", ""-  400 g d'échine de porc coupée en cubes"", ""-  400 g de gîte ou paleron de bœuf coupé en cubes"", ""-  1 pied de porc cru ou demi"", ""- sel fendu en deux"", ""-  1,2 kg de pommes de terre"", ""-  3 gros oignons"", ""-  2 grosses gousses d'ail"", ""-  50 cl de vin d'Alsace (pinot blanc ou riesling)"", ""-  30 g de farine"", ""-  1 brin de thym"", ""-  1 feuille de laurier"", ""-  Sel, poivre""]","[""La veille, mettez à mariner les viandes avec le vin, le thym, le laurier, l'ail pelé. Salez et poivrez."", ""Le lendemain, écrasez l'ail de la marinade et enduisez-en l'intérieur d'une grande terrine. Réservez la marinade. Épluchez et tranchez les pommes de terre, coupez les oignons. Allumez le four à 190 °C (th. 6)."", ""Posez le pied de porc au fond de la terrine et alternez des couches de pommes de terre, d'oignons et de viande. Arrosez de marinade, salez, poivrez. Soudez le couvercle de la terrine avec une pâte molle faite de farine et d'eau. Faites cuire 2 h 30 au four.""]",https://www.hachette-vins.com/uploads/media/cache/thumb_medium/uploads/media/recettes/0001/05/e4e097671611f0f04acdb8c2d45281806683da15.jpeg,819,6 pers.,00H30,02:30,"Un beau classique, mélange de trois viandes (porc, mouton, bœuf), à la cuisson très lente dans le four ralenti du boulanger alsacien. L'ensemble est fondant avec un mélange de parfum de viande mêlé au thym et à la pomme de terre. Choisir un"
795,Chèvres chauds aux raisins secs,"[""-  8 crottins frais"", ""-  2 bananes"", ""-  50 g de raisins secs blonds"", ""-  4 cuil. à soupe de miel liquide"", ""-  3 cuil. à soupe d'huile"", ""-  5 cl de rhum brun"", ""-  1 pincée de piment fort""]","[""Mettez le miel dans une coupelle et les raisins blonds dans une autre. Pelez les bananes et coupez-les en deux. Pimentez les crottins."", ""Passez entièrement les crottins dans le miel, puis dans les raisins."", ""Faites chauffer l'huile, à feu moyen, dans un wok ou une sauteuse à revêtement antiadhésif, et faites-y cuire les crottins 3 min."", ""Retournez les crottins et disposez autour les moitiés de bananes. Poursuivez la cuisson 7 min en retournant les bananes à mi-cuisson."", ""Versez le rhum et donnez un mouvement de rotation au wok ou à la sauteuse pour bien les enduire de rhum ; laissez prendre quelques bouillons et servez aussitôt.""]",https://www.hachette-vins.com/uploads/media/cache/thumb_medium/uploads/media/recettes/0001/05/11d4e3418218b389968030cfa2fab8c0fc522f87.jpeg,820,4 pers.,00H25,-,"Un plat qui sort du classique crottins sur toasts, néanmoins très appréciable avec le"
1170,Tarte aux pommes à la normande,"[""-  1 pâte sablée aux amandes"", ""-  2 kg de pommes boskoop"", ""-  125 g de sucre"", ""-  50 g de beurre"", ""-  1 gousse de vanille"", ""-  1 jaune d'œuf"", ""-  10 cl de calvados"", ""-  20 cl de crème fraîche""]","[""Étalez la pâte sablée dans un moule et laissez-la au frais le temps de préparer la garniture."", ""Pelez la moitié des pommes, éliminez les pépins et mettez-les à cuire dans une casserole avec le sucre, le beurre et la gousse de vanille fendue en deux dans le sens de la longueur. Faites cuire à feu doux en mélangeant fréquemment pendant environ 15 min, puis laissez refroidir."", ""Préchauffez le four à 190 °C (th. 6-7). Faites cuire la pâte 10 min au four. Réservez."", ""Épluchez le reste des pommes et coupez-les en quartiers."", ""Garnissez la tarte avec la compote de pommes dont vous aurez retiré la vanille, puis disposez les quartiers de fruit en cercle par-dessus. Dorez avec le jaune d'oeuf battu, arrosez de calvados et faites cuire 20 à 25 min environ. Servez chaud ou tiède accompagné d'une jatte de crème fraîche.""]",https://www.hachette-vins.com/uploads/media/cache/thumb_medium/uploads/media/recettes/0001/05/3efb29c4324c8a3dfd12cc1129b56a421e8b2878.jpeg,821,6 pers.,00H30,00:50,"Une tarte croquante, fondante, qui nappe le palais, un accord pomme-amande savoureux. L'acidité naturelle de la pomme permet des accords intéressants, avec ou sans bulles. On peut se permettre de jouer sur la douceur, mais sans exagérer. Un cidre demi doux sera à son avantage."
880,Magrets de canard grillés,"[""- 2 beaux magrets de canard"", ""- 4 cuil. à soupe de miel liquide"", ""- 2 cuil. à soupe de vinaigre balsamique"", ""- Sel""]","[""Faites chauffer une poêle sur feu vif. Entaillez le gras des magrets avec un couteau. Salez-les. Posez-les dans la poêle chaude et laissez cuire 10 min."", ""Retournez les magrets et laissez-les cuire 5 min. Vérifiez la cuisson, les magrets doivent être cuits mais rosés. Sortez-les de la poêle et laissez-les reposer le temps de préparer la sauce."", ""Versez le miel dans la poêle et laissez-le caraméliser légèrement, en remuant. Ajoutez le vinaigre et déglacez en frottant le fond de la poêle avec une cuillère en bois. Laissez réduire quelques minutes jusqu’à obtenir une consistance nappante."", ""Servez les magrets coupés en tranches et nappés de sauce. Accompagnez-les de purée, de pommes de terre ou d’un mélange de légumes.""]",https://www.hachette-vins.com/uploads/media/cache/thumb_medium/uploads/media/recettes/0001/08/01a9f60f360781a3b3385037ad0360d85a57c5b1.jpeg,815,4 pers.,00H10,00:20,"Le magret est une viande rouge qui, à ce titre, doit  être cuite légèrement saignante, tout au plus rosée, sous peine d’être sèche. Charnu et de goût typé, renforcé par la présence du gras, le magret demande  des vins rouges denses, étoffés, au fruité encore présent, qui en souligneront le caractère juteux et la consistance moelleuse. On les trouvera dans le Bordelais, par exemple du côté de"
1186,Moka au café,[],[],"",839,"","","",""
1187,Lasagnes à la bolognaise,"[""- Feuilles de lasagnes précuites"", ""- 1 oignon"", ""- 1 carotte"", ""- 1 branche de céleri"", ""- 30 g de beurre"", ""- 80 g de lard"", ""- 300 g de bœuf haché"", ""- 130 g de chair à saucisse"", ""- 12 cl de vin rouge"", ""- 25 cl de bouillon de bœuf"", ""- 1 petite boîte de concentré de tomates (30 g)"", ""- Parmesan râpé"", ""- 20 cl de lait"", ""- Huile d’olive"", ""- Sel, poivre\r\nPour la béchamel"", ""- 100 g de beurre"", ""- 100 g de farine"", ""- 1,25 l de lait chaud\r\nMatériel"", ""- Poêle"", ""- Mixeur"", ""- Machine à pâte\r\n \r\nRecette extraite du livre Petits Plats Italiens de Aurélie Desgages""]","[""Préparez la sauce bolognaise : hachez finement l’oignon, la carotte et le céleri. Dans une poêle à feu doux, faites fondre le beurre dans un peu d’huile d’olive. Ajoutez l’oignon, la carotte et le céleri hachés, puis faites revenir le tout pendant quelques minutes."", ""Mixez le lard, puis mélangez-le avec le bœuf haché et la chair à saucisse dans un saladier. Versez dans la poêle, puis laissez cuire 10 min en remuant de temps en temps. Versez le vin rouge, salez, poivrez et laissez évaporer. Versez un peu de bouillon."", ""Faites fondre le concentré de tomates dans un peu de bouillon et ajoutez-le dans la poêle, puis laissez mijoter 1 h 30 à feu doux tout en versant peu à peu le reste du bouillon, et enfin le lait. Réservez au chaud."", ""Préparez la béchamel : faites fondre le beurre dans une casserole, puis saupoudrez de farine en remuant sans cesse jusqu’à ce que le mélange forme une pâte épaisse. Versez en filet le lait tout en mélangeant. Assaisonnez et laissez épaissir."", ""Préchauffez le four à 200 °C (th. 6-7). Beurrez le plat à gratin. Disposez, en couches successives, des feuilles de lasagnes, de la béchamel, de la sauce bolognaise et du parmesan râpé. Saupoudrez généreusement de parmesan, puis enfournez 40 min.""]",https://www.hachette-vins.com/uploads/media/cache/thumb_medium/uploads/media/recettes/0001/08/7a4cee038dca0daaeceea48bb646172c5f39c359.jpeg,830,4 pers.,01H00,02:45,"Originaire de la région de Bologne, en Italie,"
866,Tartare de saumon au wasabi croustillant,"[""- 400 g de filet de saumon très frais (sans peau ni arêtes)"", ""- 4 ou 5 cuil. à soupe de petits pois de wasabi (épicerie asiatique)"", ""- ½ citron vert"", ""- 3 cuil. à soupe d’huile d’olive"", ""- Fleur de sel\r\nRecette extraite du livre Tartares, ceviches et carpaccios de Mélanie Martin""]","[""Concassez grossièrement les petits pois de wasabi dans un mortier ou à l’aide d’un couteau."", ""Rincez le saumon, séchez- le puis taillez- le en petits cubes."", ""Pressez le demi- citron dans un récipient et versez l’huile d’olive. Fouettez le tout avec une fourchette, puis ajoutez le saumon. Assaisonnez de fleur de sel et mélangez bien."", ""Au moment de servir, ajoutez les petits pois de wasabi concassés et mélangez soigneusement. Dégustez bien frais.""]",https://www.hachette-vins.com/uploads/media/cache/thumb_medium/uploads/media/recettes/0001/08/37d2c854417bb9a77c586adcbcd9e76f5573268f.jpeg,816,4 pers.,00H15,-,""
854,Galettes au jambon et au fromage,"[""- Pour les galettes de sarrasin"", ""- 170 g de farine de sarrasin"", ""- 80 g de farine de blé"", ""- 2 œufs"", ""- 40 cl de lait"", ""- Sel, poivre\r\nPour la garniture8 tranches de jambon2 petites tomates100 g de comté\r\nRecette extraite du livre Soirée Crêpes de Emilie Perrin""]","[""Dans un saladier, battez les œufs. Ajoutez les farines et remuez bien. Délayez avec le lait. Salez et poivrez. Laissez la pâte reposer 1 h. Faites cuire vos crêpes, avec un peu de matière grasse, sur une crêpière chaude ou dans une poêla à crêpes."", ""Coupez les tomates en rondelles fines. Sur chaque galette, disposez une tranche de jambon et un peu de tomate. Saupoudrez de comté râpé et refermez votre galette en carré."", ""Laissez cuire quelques instants sur une crêpière ou une poêle à crêpes pour que le fromage fonde et que la garniture soit bien chaude. Servez aussitôt.""]",https://www.hachette-vins.com/uploads/media/cache/thumb_medium/uploads/media/recettes/0001/09/26b4d1f0ca6a6bacd1ef5410261afb796b5283a9.jpeg,819,8 pers.,00H20,00:20,L’immuable garniture de la galette complète appelle un
1188,Moules à la crème,[],[],"",817,"","","",""
1189,Céleri rémoulade,[],[],"",820,"","","",""
902,Salade de fruits rouges et noirs à la menthe,"[""- 4 cuil. à soupe de cassonade"", ""- 4 brins de menthe"", ""- 1 citron vert"", ""- 2 barquettes de fraises"", ""- 1 barquette de framboises"", ""- 1 barquette de myrtilles"", ""- 1 barquette de mûres\r\nRecette extraite du livre Pour les enfants: Mon premier livre de cuisine de Thomas Feller""]","[""Préparez le sirop à la menthe : mettez 1 pot de yaourt rempli d’eau froide dans une casserole avec la cassonade et les feuilles de 2 brins de menthe."", ""Allumez le feu et quand l’eau bout, comptez 1 à 2 min de cuisson."", ""Éteignez et laissez refroidir. Ajoutez alors le jus du citron vert."", ""Nettoyez les fraises, équeutez-les et coupe les plus grosses en deux ou en quatre."", ""Dans un saladier, mélangez tous les fruits et versez dessus le sirop à la menthe à travers un tamis. Laissez reposer 2 h au réfrigérateur."", ""Juste avant de servir, effeuillez les derniers brins de menthe et superposez les feuilles. Coupez-les en bâtonnets les plus fins possible."", ""Mélangez une dernière fois ta salade et saupoudrez-la de menthe avant de servir.""]",https://www.hachette-vins.com/uploads/media/cache/thumb_medium/uploads/media/recettes/0001/09/c6cb1503dc6a90d9524da9c5739853645ea08727.jpeg,821,6 pers.,00H10,00:05,""
1190,Poulet au vinaigre,[],[],"",815,"","","",""
1191,Maroilles,[],[],"",834,"","","",""
1192,Aligot saucisses,[],[],"",835,"","","",""
1193,Penne à l'arrabiata,[],[],"",830,"","","",""
918,"Tatin de tomates cerises, jeunes pousses et jambon cru Aoste","[""-  6 Tranches de Jambon cru Fines et Fondantes Aoste"", ""-  1 Rouleau de pate feuilletée"", ""-  600 g de Tomates cerise"", ""-  30 g de Miel"", ""-  30 g de Parmesan"", ""-  150 g de Roquette"", ""-  2 cl d’Huile d’olive"", ""-  6 Pincées de fleur de sel"", ""-  6 Tours de moulin à poivre""]","[""Préchauffez le four à 200 °C (th. 6-7)."", ""Taillez les tranches de jambon cru Aoste en fines lanières. Réalisez quelques copeaux de parmesan à l'aide d'un économe. Dans la pâte feuilletée, taillez des disques d'un diamètre légèrement supérieur à celui des moules."", ""Dans une poêle, faites chauffer le miel et attendre qu'il colore. Ajoutez alors les tomates cerise et laissez-les cuire jusqu'à ce que la peau se fendille."", ""Répartissez-les ensuite dans les moules en les tassant légèrement."", ""Placez les disques de pâte feuilletée sur les tomates, déposez une feuille de papier cuisson et ajoutez une plaque par dessus."", ""Enfournez ensuite durant 25 min."", ""Dressez la tatin de tomates cerises sur une assiette et assaisonnez de fleur de sel et de poivre."", ""Disposez par-dessus quelques feuilles de roquette légèrement assaisonnées d'huile d'olive."", ""Ajoutez pour finir des lanières de jambon cru Aoste et quelques copeaux de parmesan.""]",https://www.hachette-vins.com/uploads/media/cache/thumb_medium/uploads/media/recettes/0001/05/4a55959f624918234a36422d9ead490e90c2a3ba.jpeg,820,4 pers.,00H10,00:25,""
908,Banderilles apéritives au Reblochon,"[""- Pour 6 personnes 1 Reblochon de Savoie 1 botte de radis roses 1 poivron vert ou rouge Chapelure au choix : sésame, pavot, Piment, cumin…""]","[""Faire des billes de la taille d’une noisette avec la pâte de Reblochon (après avoir ôté la croûte), les rouler dans la chapelure de votre choix, sésame, pavot, piment ou cumin …"", ""Couper les radis en rondelles et les poivrons en petits carrés ou triangles (enlever la peau, c’est meilleur !)"", ""Faire des pics en alternant les couleurs. A garder au frais jusqu’au moment de servir.""]",https://www.hachette-vins.com/uploads/media/cache/thumb_medium/uploads/media/recettes/0001/05/970483b0ecf9831c2b46afd8f3bf860a0a7c54e6.jpeg,838,6 pers.,00H15,-,""
917,"Médaillon de lotte lardé, fondue de poireaux et son tian de légumes au Saint-Nectaire","[""- 4 filets de queue de lotte 12 bandes de poitrine fumée 4 tranches de Saint"", ""- Nectaire 6 poireaux 4 tomates 4 aubergines 4 oignons 4 courgettes 4 cuillères à soupe de crème fraîche liquide 1 branche de thym Piment d’Espelette Beurre Huile d’olive Sel, poivre""]","[""Découper dans les filets de queue de lotte, 12 médaillons d’environ 2,5 cm d’épaisseur, les entourer d’une bande de poitrine fumée (faire tenir debout le tout avec un cure-dent à retirer avant de servir)."", ""Saler,poivrer avant de saisir à feu vif puis faire revenir doucement à la poêle avec de l’huile d’olive jusqu’à coloration des filets (environ 1 mn par côté)."", ""Émincer finement les poireaux et les cuire avec une noisette de beurre et un fond d’eau. Les égoutter puis les laisser réduire dans une casserole en ajoutant une cuillère à soupe de crème fraîche, du sel et du poivre. Couper en rondelles la tomate, la courgette, l’aubergine et l’oignon."", ""Empiler ces dernières l’une sur l’autre en commençant par l’aubergine. Coiffer le tout avec une fine tranche de Saint-Nectaire. Recommencer l’opération jusqu’à obtenir le tian. Saler, saupoudrer de thym, mouiller d’un filet d’huile d’olive puis cuire au four à 130°C de 2 à 3 mn."", ""Dresser sur le lit de poireaux les 3 médaillons, puis déposer les 3 tians autour et servir chaud.""]",https://www.hachette-vins.com/uploads/media/cache/thumb_medium/uploads/media/recettes/0001/05/73968a672812e0ae451fbb4da415ed0dd6379421.jpeg,816,4 pers.,-,-,""
1197,Chicken Wings,"[""- 24 ailes de poulet"", ""- 1 l d’huile végétale"", ""- 50 g de beurre"", ""- 12,5 cl de ketchup"", ""-  Quelques gouttes de Tabasco"", ""- 2 cuil. à café de vinaigre blanc"", ""- 3 carottes"", ""- 3 branches de céleri"", ""- 1 petit pot de fromage blanc"", ""- 50 g de roquefort"", ""- Sel et poivre du moulin\r\n \r\nRecette extraite du livre Etats"", ""- Unis : le best"", ""- of de Mélanie Martin""]","[""Coupez en deux parties à la jointure les ailes de poulet. Faites chauffer l’huile dans une grande casserole et plongez-y les ailes de poulet pendant 8 à10 min le temps qu’elles soient bien dorées. Égouttez-les avec une écumoire puis déposez-les sur des feuilles de papier absorbant."", ""Dans une large poêle, faites fondre le beurre puis versez le ketchup, quelques gouttes de Tabasco en fonction de votre goût et le vinaigre blanc. Ajoutez les ailes de poulet frites, remuez bien et laissez tiédir."", ""Pelez et coupez en bâtonnets les carottes et les branches de céleri. Dans un petit récipient, mélangez avec une fourchette le fromage blanc avec le roquefort en prenant soin de bien l’écraser. Salez légèrement et poivrez. Dégustez aussitôt.""]",https://www.hachette-vins.com/uploads/media/cache/thumb_medium/uploads/media/recettes/0001/09/c808269432a33155cc17d8095007a0a36fba31c8.jpeg,815,4 pers.,00H35,00:08,"Plus ou moins relevés, les chicken wings réclament un vin rouge de concentration moyenne, fruités et chaleureux qui feront écho à la sauce barbecue. L'appellation"
897,Tournedos au beurre de truffe,"[""- 4 tournedos de boeuf"", ""- 40 g de beurre clarifié"", ""- fleur de sel"", ""- poivre du moulin  Beurre de truffe :"", ""- 100 g de beurre à température ambiante"", ""- 1 cuil. à soupe de madère"", ""- ½ truffe (en boîte avec son jus)   Matériel : hachoir • film alimentaire""]","[""Préparez le beurre de truffe : hachez la truffe. Incorporez-la au beurre ramolli avec le madère et 1 cuil. à soupe de jus de truffe. Vérifiez l’assaisonnement. Roulez le beurre dans du film alimentaire et conservez-le au froid 45 min."", "". Dans une poêle, faites fondre le beurre clarifié et déposez-y les tournedos. Cuisez-les quelques minutes (selon l’appoint de cuisson souhaité). Assaisonnez de fleur de sel et de poivre du moulin."", ""Taillez le beurre en rondelles, placez-le sur les tournedos et servez aussitôt."", """", ""Suggestions :"", ""accompagnez votre plat de pommes de terre cuites au four avec de la fleur de sel.""]",https://www.hachette-vins.com/uploads/media/cache/thumb_medium/uploads/media/recettes/0001/08/8bb9999221445aef3e7b8477f8cee7aba87845ae.jpeg,818,4 pers.,00H20,00:04,"Une recette qui associe deux mets de grande réputation comme le filet de bœuf et la truffe. La viande est d’une extrême finesse, tendre et savoureuse, et la truffe confère au plat de puissants arômes typés. L’accord nécessite un vin rond et soyeux, au bouquet séduisant et corsé, à l’image d’un pomerol. Séveux et très tendre, le vin complétera de façon fusionnelle la texture de la viande, et développera un bouquet caractéristique de fruits rouges, de cuir, de violette et de truffe, qui s’harmonisera aux parfums puissants du plat."
226,Cannelés,"[""- 50 g de beurre"", ""- 50 cl de lait entier"", ""- 150 g de farine"", ""- 250 g de sucre en poudre + pour les moules"", ""- 1 pincée de sel"", ""- 2 cuil. à soupe de rhum brun"", ""- 1 oeuf entier + 2 jaunes  Matériel :"", ""- moules à cannelés en silicone"", ""- pinceau de cuisine"", ""- tamis""]","[""Préparez les moules. Dans une casserole, faites fondre le beurre et badigeonnez-en l’intérieur des moules à l’aide d’un pinceau. Saupoudrez-les d’un peu de sucre en poudre et laissez prendre quelques minutes dans le réfrigérateur avant de recommencer l’opération une seconde fois. Préchauffez le four à 180 °C (th. 6)."", ""Dans la casserole qui a servi à faire fondre le beurre, versez le lait et portez-le à ébullition. Dans un saladier, mélangez la farine, le sucre, le sel, le rhum et tous les oeufs. Fouettez vigoureusement et versez en un mince filet le lait bouillant, sans cesser de remuer. Passez au travers d’un tamis afin d’éliminer les grumeaux."", ""Versez la pâte dans les moules, aux deux tiers de leur hauteur. Enfournez pour 50 min de cuisson. Sortez les cannelés du four et démoulez-les. Consommez-les rapidement."", """", """", ""Conseil :"", ""vous pouvez ajouter dans la pâte les graines d’une gousse de vanille.""]",https://www.hachette-vins.com/uploads/media/cache/thumb_medium/uploads/media/recettes/0001/08/dbec412c1239ef3d6b8349492b8fa587d9f97df7.jpeg,1,16 pers.,00H15,00:45,"Grande spécialité bordelaise, les cannelés sont de petites pâtisseries craquantes et caramélisées, qui offrent un coeur souple et fondant, et exhalent un délicieux parfum de beurre et de rhum brun. Les liquoreux locaux -"
899,Aiguillettes de canard aux noix de cajou,"[""-  600 g d'aiguillettes de canard"", ""-  250 g de riz à cuisson rapide"", ""-  50 g de noix de cajou non salées"", ""-  25 g de raisins secs"", ""-  3 cuil. à soupe d'oignons émincés surgelés"", ""-  1/2 cuil. à café d'ail en poudre"", ""-  1/2 cuil. à café de thym"", ""-  1 cuil. à soupe de curry"", ""-  5 cl de vinaigre de xérès"", ""-  3 cuil. à soupe d'huile"", ""-  Sel, poivre""]","[""Faites chauffer 2 cuillerées d'huile à feu moyen dans une cocotte. Ajoutez les oignons et le curry et faites-les revenir 2 min en remuant. Versez le riz et tournez-le dans l'huile Pour enrober les grains."", ""Versez 15 cl d'eau chaude dans la cocotte, ajoutez les raisins secs, l'ail, le thym, du sel et du poivre. Faites cuire, à couvert, à feu doux pendant 10 min, puis mélangez les noix de cajou au riz et poursuivez la cuisson pendant 2 min, jusqu'à complète absorption du liquide par le riz."", ""Salez et poivrez les aiguillettes de canard. Faites chauffer le restant d'huile à feu moyen dans une poêle et faites-y cuire les aiguillettes en les retournant. Comptez de 5 min à 7 min, selon le degré de cuisson voulu. Retirez les aiguillettes et tenez-les au chaud. Versez le vinaigre dans la poêle et faites cuire encore 2 min, en grattant les sucs de cuisson avec une spatule."", ""Disposez le riz et les aiguillettes sur un plat chaud et nappez de sauce.""]",https://www.hachette-vins.com/uploads/media/cache/thumb_medium/uploads/media/recettes/0001/05/40c94cde288eb32c503c6d419733706aeb41faa7.jpeg,815,4 pers.,00H10,00:15,"Un plat corsé mais tout en douceur orientale : ce plat à base de gibier à plumes, le canard, est un plat à cuisson courte associée aux fruits secs et au curry. Choisissez un vin blanc de préférence, sec et corsé pour le contraste avec le gras des noix de cajou et le confit des raisins, comme un"
1198,Cake au citron,"[""-  150 g de beurre + 10 g pour le moule"", ""-  150 g de sucre en poudre"", ""-  3 œufs entiers"", ""-  2 citrons"", ""-  250 g de farine tamisée"", ""-  1 sachet de levure"", ""-  1 pincée de sel""]","[""Laissez le beurre ramollir à température ambiante, puis travaillez-le avec le sucre jusqu'à ce que le mélange blanchisse. Ajoutez les oeufs un à un et mélangez pour obtenir une préparation homogène."", ""Râpez le zeste des citrons et pressez-les. Ajoutez le zeste et le jus au mélange précédemment obtenu. Versez au fur et à mesure la farine, le sel, puis la levure et mélangez bien afin d'éviter les grumeaux. Assurez-vous que le mélange est parfaitement homogène."", ""Beurrez un moule à cake et versez-y la préparation. Laissez reposer le cake environ 1 h avant de l'enfourner. Faites chauffer le four pendant 20 min à 200 °C (th. 7). Enfournez et laissez cuire 40 min."", ""Sortez le cake du four. Vérifiez sa cuisson en y plantant la lame d'un couteau, elle doit en ressortir propre. Démoulez le cake et déposez-le sur une grille.""]",https://www.hachette-vins.com/uploads/media/cache/thumb_medium/uploads/media/recettes/0001/05/5570cda37b55f8299afec46f3db862aff1e009d8.jpeg,821,6 pers.,00H20,00:40,"Un plat qui sait être aromatique grâce aux agrumes. Au contact de la pâte à cake, le vin peut se présenter avec effervescence afin d'alléger la consistance du cake ("
